{"date":"2026-09-09","syntax":{"topic":"C/C++ 입출력 동기화와 `cin` 묶음","headline":"`sync_with_stdio(false)`는 C 연동을, `cin.tie(nullptr)`는 자동 비우기를 끈다.","body":"- 동기화를 끄면 C++ 스트림이 `scanf`/`printf`와 버퍼를 따로 써 빨라질 수 있지만, 섞어 쓴 출력 순서는 믿을 수 없다.\n- 묶음을 끊으면 `cin` 직전의 `cout` 자동 비우기가 사라진다. 대화형 안내문은 직접 `flush`한다.\n- 둘 다 버퍼링 자체를 끄는 설정은 아니다.","code":"```cpp\n// 이렇게 쓰기 쉽다: 두 입출력 계열을 섞는다\nstd::ios::sync_with_stdio(false);\nstd::cout << \"A\";\nprintf(\"B\\n\"); // 출력 순서를 기대하기 어렵다\n\n// 이렇게 고친다: C++ 입출력만 쓴다\nstd::cin.tie(nullptr);\nint n;\nstd::cout << \"입력: \" << std::flush;\nstd::cin >> n;\nstd::cout << n << '\\n';\n```","quiz":"`cin.tie(nullptr)` 뒤에 `cout << \"입력: \"; cin >> x;`를 실행하면 안내문이 입력 전에 반드시 보일까? 아니라면 어떻게 고칠까?","answer":"반드시 보이지는 않는다. `cin`이 `cout`을 자동으로 비우지 않으므로 `cout << \"입력: \" << flush;`처럼 직접 비운다."},"algo":{"title":"최고의 33위치","link":"https://www.codetree.ai/missions/2/problems/best-place-of-33","path":"240215/최고의 33위치/best-place-of-33.py","tag":"Intermediate Low · Simulation · 격자 안에서 완전탐색 · 쉬움","summary":"(코드에서 역추론) `n×n` 격자에서 3×3 구역 하나를 골라, 값이 `1`인 칸의 최대 개수를 구하는 문제로 보인다.","question":"각 후보에서 3×3을 다시 세어도 왜 O(n²)인가? 원래 `n≥3`인 0/1 격자였는지도 떠올리고, 아니라면 어느 가정이 먼저 깨지는가?","answer":"3×3은 9칸으로 고정이라 후보 하나는 O(1), 후보 수는 O((n-2)²)이므로 시간은 O(n²)다. 입력 저장 공간은 O(n²), 함수 내부 공간은 O(1)이다. 원래 제약이 `n≥3`·0/1이 아니었다면 유효 후보 범위나 `==1` 비교부터 다시 봐야 한다.","code_review":"1. `check([i,j])`는 후보마다 리스트를 새로 만든다.\n`check(i,j)`로 좌표만 넘기면 할당을 없앤다.\n2. `global max_coin`은 계산과 갱신 책임을 섞는다.\n`check`가 개수를 반환하면 흐름이 선명하다.\n3. 유효하지 않은 가장자리 좌표에도 `check`를 호출한다.\n반복 범위를 `range(n-2)`로 잡으면 경계 검사가 사라진다."},"optimized":{"verdict":"개선 여지 있음","idea":"- 전체 격자 대신 최근 3행만 보관한다.\n- 세 행에서 너비 3의 합을 옆으로 밀면 각 칸을 O(1)에 처리한다.\n- 원래 입력 크기는 모르지만, 공간 복잡도 감소는 n으로 비교할 수 있다.","code":"```cpp\nstd::vector<std::vector<int>> rows(3, std::vector<int>(n));\nint best = 0;\nfor (int r = 0; r < n; ++r) {\n    auto& row = rows[r % 3];\n    for (int& x : row) {\n        std::cin >> x;\n        x = (x == 1);\n    }\n    if (r < 2) continue;\n    int sum = 0;\n    for (int c = 0; c < n; ++c) {\n        for (auto& v : rows) sum += v[c];\n        if (c >= 3)\n            for (auto& v : rows) sum -= v[c - 3];\n        if (c >= 2) best = std::max(best, sum);\n    }\n}\nstd::cout << best << '\\n';\n```","gain":"시간 O(n²)은 유지되고, 입력 저장 공간은 O(n²)→O(n)으로 줄어든다."}}