{"date":"2026-09-12","syntax":{"topic":"문자열 파싱: stringstream, getline, stoi/stod","headline":"구분자는 `getline`, 숫자는 `stoi`·`stod`로 읽되 남은 문자와 예외까지 확인한다.","body":"- `getline(ss, tok, ',')`는 쉼표 단위로 자르며, 연속된 쉼표 사이에는 빈 문자열이 나온다.\n- `stoi`·`stod`는 숫자 접두부만 바꿀 수 있어 변환 위치도 확인해야 한다.\n- 숫자가 없으면 `invalid_argument`, 범위를 넘으면 `out_of_range`를 던진다.","code":"```cpp\nstring s = \"12,,3x\", tok;\nstringstream ss(s);\n// 이렇게 쓰기 쉽다\nwhile (getline(ss, tok, ',')) cout << stoi(tok) << ' ';\n// 이렇게 고친다\nstringstream safe(s);\nwhile (getline(safe, tok, ',')) {\n    if (tok.empty()) { cout << \"빈값 \"; continue; }\n    size_t pos = 0;\n    try {\n        int n = stoi(tok, &pos);\n        if (pos != tok.size()) throw invalid_argument(\"suffix\");\n        cout << n << ' ';\n    } catch (const exception&) { cout << \"오류 \"; }\n}\n```","quiz":"`stoi(\"42px\", &pos)`의 반환값과 `pos`는 무엇인가? 또 `stoi(\"\")`는 어떤 예외를 던지는가?","answer":"반환값은 `42`, `pos`는 `2`다. 숫자 접두부만 소비했으므로 `px`는 남는다. 빈 문자열에는 숫자가 없어 `invalid_argument`를 던진다."},"algo":{"title":"문자열 순서 바꾸기","link":"https://www.codetree.ai/missions/4/problems/change-order-of-strings","path":"240904/문자열 순서 바꾸기/change-order-of-strings.cpp","tag":"Novice Low / 입출력 / 문자, 문자열 입력 · 쉬움","summary":"(코드에서 역추론) 두 문자열 `a`, `b`를 입력받고, 입력과 반대 순서인 `b`, `a`를 각각 한 줄에 출력하는 문제로 보인다.","question":"원래 문자열에 공백이 없다는 제약이었나? 공백이 허용되면 `cin >> a >> b`는 왜 깨지며, 줄 단위 입력으로 고쳐도 시간 하한은 왜 O(|a|+|b|)인가?","answer":"공백 없는 문자열이라면 `a`, `b`를 읽어 `b`, 줄바꿈, `a` 순으로 출력하면 끝난다. 공백이 허용되면 `>>`가 공백에서 끊기므로 `getline`이 필요하다. 입력과 출력을 모두 훑어야 하므로 시간 O(|a|+|b|), 문자열 저장 공간 O(|a|+|b|)다.","code_review":"1. `string`을 직접 쓰면서 `<string>`을 포함하지 않았다.\n다른 헤더의 간접 포함에 기대지 말고 명시해야 이식성이 생긴다.\n2. `endl`은 필요 없는 버퍼 비우기까지 수행한다.\n단순 줄바꿈이면 `'\\n'`이 의도를 더 정확히 드러낸다."},"optimized":{"verdict":"이미 최적","idea":"- 출력 순서만 뒤집으면 되므로 별도 변환이나 자료구조가 필요 없다.\n- 두 문자열 전체를 읽고 출력해야 해 시간 하한이 O(|a|+|b|)다.\n- `<string>`을 포함하고 `endl` 대신 `'\\n'`을 쓴다.","code":"```cpp\n#include <iostream>\n#include <string>\nusing namespace std;\n\nint main() {\n    string a, b;\n    cin >> a >> b;\n    cout << b << '\\n' << a;\n}\n```","gain":"복잡도는 O(|a|+|b|)로 이미 최적이며, 불필요한 버퍼 비우기만 없어진다."}}