{"date":"2026-09-11","syntax":{"topic":"std::string 기본기: 찾기·자르기·끝 수정","headline":"찾고 잘라 붙이되, `npos`와 빈 문자열 확인으로 경계를 지킨다.","body":"- `substr(pos, count)`는 복사본을 만들며, `pos`가 길이를 넘으면 예외가 난다.\n- `find` 결과는 참·거짓으로 쓰지 말고 `npos`와 비교한다.\n- `+=`는 덧붙인다. `back`과 `pop_back` 전에는 비었는지 확인한다.","code":"```cpp\nstd::string s = \"alpha/beta\";\n// 이렇게 쓰기 쉽다\nsize_t p = s.find(':');\nauto tail = s.substr(p + 1); // npos+1이 0\nstd::string empty;\nempty.pop_back();           // 빈 문자열\n\n// 이렇게 고친다\np = s.find('/');\nif (p != std::string::npos)\n    tail = s.substr(p + 1);\ns += \"/\";\nif (!s.empty() && s.back() == '/') s.pop_back();\n```","quiz":"`std::string s = \"abc\";`일 때 `if (s.find(\"ab\"))`와 `if (s.find(\"x\"))` 중 어느 조건문이 실행될까?","answer":"두 번째만 실행된다. `\"ab\"`의 위치는 `0`이라 거짓이고, 실패값 `npos`는 큰 부호 없는 정수라 참으로 바뀐다. 그래서 반드시 `find(...) != std::string::npos`로 비교한다."},"algo":{"title":"날짜 변경하여 출력 2","link":"https://www.codetree.ai/missions/4/problems/print-date-with-different-format-2","path":"240904/날짜 변경하여 출력 2/print-date-with-different-format-2.cpp","tag":"Novice Low · 입출력 · 특정 문자를 사이에 두고 입력 · 쉬움","summary":"(코드에서 역추론) 월·일·년 사이에 구분자 2개가 놓인 입력으로 보인다.\n세 수를 읽어 `년.월.일` 순서로 바꿔 출력하는 문제다.","question":"원래 제약은 두 구분자의 위치와 길이를 어떻게 보장했나? 그 보장 아래 같은 변수 `j`에 두 번 읽어도 되는 이유와 입력 길이 L에 대한 시간 하한을 설명해보자.","answer":"각 구분자가 정해진 위치의 한 글자이고 검증할 필요가 없다는 제약이었다면, 덮어쓴 `j`를 다시 쓰지 않으므로 결과에는 영향이 없다. 숫자와 구분자를 모두 읽고 결과도 써야 하므로 시간은 O(L)이며 Ω(L)보다 줄일 수 없다. 보조 공간은 O(1)이다.","code_review":"1. 두 구분자를 모두 `j`에 읽어 차이를 잃는다.\n원래 형식이 둘을 보장하지 않았다면 검증할 수 없다.\n2. `y`, `m`, `d`, `j`는 뜻을 다시 해석해야 한다.\n`year`, `month`, `day`, `separator`가 더 선명하다.\n3. `dot` 변수는 한 번만 쓰여 불필요하다.\n출력에서 `'.'`을 바로 쓰면 흐름이 짧아진다."},"optimized":{"verdict":"이미 최적","idea":"- 입력 토큰을 한 번씩 읽고 출력하므로 시간 하한 Ω(L)을 이미 만족한다.\n- 별도 저장 구조가 없어 보조 공간도 O(1)이다.\n- 이름을 풀어 쓰고 `'.'`을 직접 출력하는 정도만 다듬는다.","code":"```cpp\nint month, day, year;\nchar first_separator, second_separator;\n\nstd::cin >> month >> first_separator\n         >> day >> second_separator >> year;\nstd::cout << year << '.' << month << '.' << day;\n```","gain":"O(L) → O(L), 보조 공간 O(1); 점근적 개선 없이 가독성만 좋아진다."}}