{"date":"2026-09-10","syntax":{"topic":"push_back와 emplace_back의 임시 객체","headline":"`push_back(T{...})`는 별도 `T`를 만들지만, `emplace_back(...)`는 원소를 제자리 생성한다.","body":"- `push_back(T{...})`는 임시 `T`를 만든 뒤 컨테이너 원소로 이동한다.\n- `emplace_back(...)`는 생성자 인수를 전달해 저장 공간에서 `T`를 바로 만든다.\n- 재할당 때 기존 원소가 이동하는 비용은 둘 다 생길 수 있다.","code":"```cpp\n#include <string>\n#include <utility>\n#include <vector>\nstruct Item {\n    std::string name;\n    explicit Item(std::string s) : name(std::move(s)) {}\n};\nint main() {\n    std::vector<Item> items;\n    items.reserve(2);\n    // 이렇게 쓰기 쉽다: 임시 Item 1개를 만든 뒤 이동\n    items.push_back(Item{\"책\"});\n    // 이렇게 고친다: Item을 저장 공간에 바로 생성\n    items.emplace_back(\"연필\");\n}\n```","quiz":"용량이 충분할 때 `items.push_back(Item{\"책\"})`와 `items.emplace_back(\"책\")`는 별도 `Item` 임시 객체를 각각 몇 개 만드는가?","answer":"`push_back`은 1개, `emplace_back`은 0개다. 전자는 임시 `Item`을 원소로 이동하고, 후자는 원소 자체를 바로 생성한다."},"algo":{"title":"길이 단위 환산하기","link":"https://www.codetree.ai/missions/4/problems/convert-length-units","path":"240904/길이 단위 환산하기/convert-length-units.cpp","tag":"Novice Low · 입출력 · 실수 입력 · 쉬움","summary":"(코드에서 역추론) 실수 하나를 입력받아 1피트를 30.48cm로 보는 환산을 한 뒤, 소수 첫째 자리까지 출력하는 문제로 보인다.","question":"곱셈 한 번이면 충분한 이유는 무엇인가? 원래 입력값 범위와 출력 오차·자리수 조건은 무엇이었으며, 그 제약에서 `double`과 소수 1자리 출력이 맞았나?","answer":"단위 사이의 비율이 일정하므로 입력에 30.48을 한 번 곱하면 된다. 입력과 출력이 각각 하나라 시간 O(1), 공간 O(1)이다. 원래 범위와 정밀도 조건이 없어 `double`과 소수 1자리가 충분한지는 코드만으로 확정할 수 없다.","code_review":"1. `#define FEET 30.48`은 형과 범위가 없다.\n`constexpr double kCmPerFoot = 30.48;`이 뜻도 선명하다.\n2. `endl`은 매번 버퍼를 비운다.\n즉시 출력이 필요 없다면 `‘\\n’`이 더 알맞다."},"optimized":{"verdict":"이미 최적","idea":"- 단일 입력을 읽어 한 번 곱하고 출력하므로 시간·공간은 이미 O(1)이다.\n- 입력과 출력을 생략할 수 없어 Ω(1)보다 낮출 수 없다.\n- `constexpr`와 단위가 드러나는 이름으로 의도만 선명하게 만든다.","code":"```cpp\n#include <iomanip>\n#include <iostream>\n\nint main() {\n    constexpr double kCmPerFoot = 30.48;\n    double feet;\n    std::cin >> feet;\n\n    std::cout << std::fixed << std::setprecision(1)\n              << feet * kCmPerFoot << '\\n';\n}\n```","gain":"시간 O(1)·공간 O(1)은 그대로이며, 매크로와 불필요한 버퍼 비우기만 없앤다."}}